{
  "blockers": [],
  "cost": {
    "cachedTokens": 0,
    "inputTokens": 2234,
    "outputTokens": 399,
    "usd": 0
  },
  "createdAt": "2026-10-29T15:56:47.470Z",
  "findings": [],
  "model": "ollama/muse-glimmer:30b-mlx",
  "offline": true,
  "run": "r2",
  "summary": "No actionable findings.",
  "verdict": "approve",
  "version": "stint.review/1"
}
